{
  "$id": "urn:ratatoskr:contracts:core:v1:EventEnvelope",
  "$schema": "https://json-schema.org/draft/2020-12/schema",
  "title": "EventEnvelope",
  "description": "The common envelope for every asynchronous domain event (`ARCHITECTURE.md` S5.2).\n\n**Tolerant reader.** Unknown top-level fields land in [`Self::extensions`] and are re-emitted\nunchanged, so adding an optional envelope field stays backward compatible exactly as\n`AGENTS.md` classifies it. A future *envelope major* is a different matter and is refused by\n[`EnvelopeSchemaVersion`].\n\nField order below is the order in `ARCHITECTURE.md` S5.2, and derived `Serialize` preserves\nit, so the documented example is a byte-exact fixture.",
  "type": "object",
  "properties": {
    "aggregate_id": {
      "description": "Namespaced reference to the aggregate the fact is about, e.g. `document:018f…` or\n`x-post:123`. Polymorphic — the referent kind varies by event type — therefore an\n[`EntityRef`] and not a typed newtype. Required.",
      "$ref": "#/$defs/EntityRef"
    },
    "causation_id": {
      "description": "Namespaced reference to the record that directly caused this event — an event today, a\ncommand once command contracts land. Optional: absent when the event has no in-system\ncause, such as an external webhook, a scheduled sweep, or a user's first request.\n`AGENTS.md`: \"causation ID when applicable\". `null` and absent both parse to `None`, and\n`None` always serializes as absent.",
      "anyOf": [
        {
          "$ref": "#/$defs/EntityRef"
        },
        {
          "type": "null"
        }
      ]
    },
    "correlation_id": {
      "description": "Namespaced reference tying this event to the unit of user-visible work it belongs to, e.g.\n`operation:018f…`. Required: `AGENTS.md` lists a correlation ID unconditionally, and an\nevent with no correlation cannot be traced through an at-least-once replay. A root event\nwith no owning operation correlates to itself as `event:<event_id>`.",
      "$ref": "#/$defs/EntityRef"
    },
    "event_id": {
      "description": "Globally unique identity of this event occurrence, and the at-least-once deduplication\nkey. `UUIDv7` for newly minted events. Bare UUID on the wire, not namespaced. Required.",
      "$ref": "#/$defs/EventId"
    },
    "event_type": {
      "description": "`<bounded_context>.<aggregate>.<action>.v<major>`. The suffix is the **payload** major.\nRequired.",
      "$ref": "#/$defs/EventType"
    },
    "occurred_at": {
      "description": "Instant at which the fact became true in the producing bounded context. Producer-asserted:\nthe clock is the producer's. Neither the publish time nor the receive time; the envelope\ncarries no such field. Required.",
      "$ref": "#/$defs/WireTimestamp"
    },
    "payload": {
      "description": "Event-type-specific body. Always a JSON object, never a scalar or an array, so payload\ncontracts can evolve additively. Typed as a map, so \"payload is an object\" is a type-level\nfact and a schema fact with no runtime check. Required; an event with nothing to say\ncarries `{}`.",
      "type": "object",
      "additionalProperties": true
    },
    "producer": {
      "description": "The deployable that asserted the fact. Required.",
      "$ref": "#/$defs/ProducerName"
    },
    "schema_version": {
      "description": "Major version of the envelope contract. Always 1 in this build. Required.",
      "$ref": "#/$defs/EnvelopeSchemaVersion"
    },
    "tenant_id": {
      "description": "The owner of the data this fact concerns. Optional: absent on system-scoped events that\nbelong to no single user. `AGENTS.md`: \"owner/tenant identity where required\". `null` and\nabsent both parse to `None`, and `None` always serializes as absent.",
      "anyOf": [
        {
          "$ref": "#/$defs/TenantRef"
        },
        {
          "type": "null"
        }
      ]
    }
  },
  "additionalProperties": true,
  "required": [
    "aggregate_id",
    "correlation_id",
    "event_id",
    "event_type",
    "occurred_at",
    "payload",
    "producer",
    "schema_version"
  ],
  "x-ratatoskr-provenance": {
    "canonical_source": "ratatoskr_event_envelope::EventEnvelope",
    "contract_id": "core.event_envelope",
    "contract_major_version": 1,
    "generated": "DO NOT EDIT — generated by contractsc from the canonical Rust source. Change the Rust type and run `cargo contracts generate`.",
    "generator": "contractsc",
    "generator_version": "0.1.0",
    "schemars_version": "1.2.2",
    "source_digest": "sha256:c4b59ebda8d5c26edd84f12879bf991ee2d1b5bf01ac651cec31b434eb0ec5eb",
    "validation_note": "This schema is a LOWER BOUND on validity. Cross-field invariants and canonical-form rules are enforced by the canonical Rust type; see fixtures/invalid-expectations.toml for which layer rejects what."
  },
  "x-ratatoskr-unknown-policy": "preserve",
  "$defs": {
    "EntityRef": {
      "title": "EntityRef",
      "description": "A namespaced, polymorphic wire reference, serialized as `<kind>:<local_id>`. The kind vocabulary is open: an unrecognised kind is preserved verbatim. The local identity is opaque and need not be a UUID.",
      "type": "string",
      "examples": [
        "document:018f0000-0000-7000-8000-000000000002",
        "x-post:123"
      ],
      "maxLength": 289,
      "pattern": "^[a-z][a-z0-9_-]{0,31}:[A-Za-z0-9][A-Za-z0-9._~:@+-]{0,255}$"
    },
    "EnvelopeSchemaVersion": {
      "title": "EnvelopeSchemaVersion",
      "description": "Major version of the envelope contract. Always 1 for this schema.",
      "type": "integer",
      "const": 1
    },
    "EventId": {
      "title": "EventId",
      "description": "Identity of one event occurrence, and the at-least-once deduplication key. Bare canonical lowercase hyphenated UUID; not namespaced.",
      "type": "string",
      "format": "uuid",
      "examples": [
        "018f0000-0000-7000-8000-000000000001"
      ],
      "pattern": "^[0-9a-f]{8}-[0-9a-f]{4}-[0-9a-f]{4}-[0-9a-f]{4}-[0-9a-f]{12}$"
    },
    "EventType": {
      "title": "EventType",
      "description": "An event name, `<bounded_context>.<aggregate>.<action>.v<major>`. The `.v<major>` suffix versions the payload contract, not the envelope. Segments are snake_case; the action is past tense because an event is a completed fact.",
      "type": "string",
      "examples": [
        "content.document.extracted.v1",
        "platform.operation.progressed.v1"
      ],
      "maxLength": 128,
      "pattern": "^[a-z][a-z0-9_]{0,31}\\.[a-z][a-z0-9_]{0,31}\\.[a-z][a-z0-9_]{0,31}\\.v[1-9][0-9]{0,3}$"
    },
    "ProducerName": {
      "title": "ProducerName",
      "description": "The deployable that emitted this record, e.g. `ratatoskr-extractor`.\n\nA deployment identity, not an instance identity: never a hostname, pod name, region or\nbuild version. Kebab-case, because the service names in `README.md` and\n`ARCHITECTURE.md` S5.2 are kebab-case. Every value used inside this repository must be\nregistered in `contracts.toml [services].known`.",
      "type": "string",
      "examples": [
        "ratatoskr-extractor",
        "ratatoskr-x"
      ],
      "maxLength": 64,
      "pattern": "^[a-z][a-z0-9-]{1,63}$"
    },
    "TenantRef": {
      "title": "TenantRef",
      "description": "The owner of the data a record concerns, wire form `user:<uuid>`. The kind set is closed: a consumer that cannot understand the owner kind must reject the record rather than process it.",
      "type": "string",
      "examples": [
        "user:018f0000-0000-7000-8000-000000000005"
      ],
      "maxLength": 41,
      "pattern": "^user:[0-9a-f]{8}-[0-9a-f]{4}-[0-9a-f]{4}-[0-9a-f]{4}-[0-9a-f]{12}$"
    },
    "WireTimestamp": {
      "title": "WireTimestamp",
      "description": "An instant on the wire: RFC 3339 in UTC with the literal `Z` designator. Exactly one spelling is accepted per instant — an input that does not re-render to itself is rejected. The field holding it declares the clock authority.",
      "type": "string",
      "format": "date-time",
      "examples": [
        "2026-08-17T10:00:00Z"
      ],
      "pattern": "^\\d{4}-\\d{2}-\\d{2}T\\d{2}:\\d{2}:\\d{2}(\\.\\d{1,9})?Z$"
    }
  }
}
