{
  "event_id": "018f0000-0000-7000-8000-000000000061",
  "event_type": "social.source.synced.v1",
  "occurred_at": "2026-08-17T10:00:00Z",
  "producer": "ratatoskr-x",
  "aggregate_id": "social_source:018f0000-0000-7000-8000-000000000062",
  "correlation_id": "operation:018f0000-0000-7000-8000-000000000063",
  "schema_version": 1,
  "payload": {}
}
