{
  "event_id": "018f0000-0000-7000-8000-000000000031",
  "event_type": "x.bookmark.observed.v1",
  "occurred_at": "2026-08-17T10:00:00Z",
  "producer": "ratatoskr-x",
  "aggregate_id": "x-post:123",
  "correlation_id": "operation:018f0000-0000-7000-8000-000000000032",
  "schema_version": 1,
  "payload": {}
}
